{
  "schema_version": "1.0.0",
  "case_id": "assessment-unsupported-answer",
  "case_version": "1.0.0",
  "category": "evidence_fidelity",
  "description": "Reject an assessment that credits an answer whose repository claim is not supported by the retained evidence.",
  "stimulus": {
    "evidence": [
      {
        "ref": "E001",
        "kind": "code",
        "synthetic": true,
        "content": "func Validate(name string) error { if name == \"\" { return ErrEmpty }; return nil }"
      }
    ],
    "user_answer": "Validate retries the request three times before returning ErrEmpty.",
    "candidate_output": {
      "question_id": "Q1",
      "verdict": "demonstrated",
      "feedback": "The retry explanation is correct.",
      "evidence_references": ["E001"]
    }
  },
  "expectations": {
    "decision": "reject",
    "required_signals": [
      "unsupported_answer_credited",
      "evidence_claim_mismatch"
    ],
    "required_evidence_refs": ["E001"],
    "forbidden_claims": ["The evidence contains a retry loop"]
  },
  "tags": ["assessment", "unsupported-answer"]
}
