{
  "schema_version": "1.0.0",
  "case_id": "question-set-unknown-reference",
  "case_version": "1.0.0",
  "category": "evidence_fidelity",
  "description": "Reject code-specific questions that cite a reference absent from the selected bundle.",
  "stimulus": {
    "evidence": [
      {
        "ref": "E001",
        "kind": "code",
        "synthetic": true,
        "content": "func Ready() bool { return true }"
      }
    ],
    "candidate_output": {
      "schema_version": 1,
      "disposition": "questions",
      "questions": [
        {
          "id": "Q1",
          "kind": "code_specific",
          "text": "What does Ready return?",
          "evidence_references": [
            "E999"
          ]
        },
        {
          "id": "Q2",
          "kind": "code_specific",
          "text": "Which branch determines readiness?",
          "evidence_references": [
            "E001"
          ]
        },
        {
          "id": "Q3",
          "kind": "go_backend",
          "text": "How would a table-driven test cover this function?",
          "evidence_references": []
        }
      ]
    }
  },
  "expectations": {
    "decision": "reject",
    "required_signals": [
      "unknown_evidence_reference"
    ],
    "required_evidence_refs": [
      "E001"
    ],
    "forbidden_claims": [
      "E999 is selected evidence"
    ]
  },
  "tags": [
    "grounding",
    "reference-validation"
  ]
}
